comment,likes,my_polarity
"наверное мне слабо...... Исходя из всего,что было в моей жизни. К сожалению,такова правда,именно в моей жизни,делаю акцент,что б не писали что все не могут быть одинаковые и т.д...И судя из того,что я вижу,читаю и слышу. Это мое субъективное мнение и я его не навязываю!
 Когда есть потребность,люди пишут или говорят с кем-то,у меня не было возможности поговорить и поэтому я написала..... А как,кто воспримет,и что возьмёт,это дело каждого человека!",1.0,0.0
"с удовольствием!!! Могу сделать пару шт по 1 кг,что б больше было,так сказать)) Кто знает,куда и как,напишите в месенджер! Один раз в неделю или тортики-для тех кто нуждается! 🤗
 Уже один человек обратился в личку по поводу орешков,поддержать молодого человека! Так что,пишите пожалуйста,доброе дело сделать,это наверное самое главное! 💕",5.0,1.0
"это вы так увидели и прочитали!
 Каждый видит в посте,то,что он хочет увидеть....",5.0,0.0
"очень много было сравнений их Майдана и наших протестов. Обидных для украинцев. Хотя они победили, а мы пока нет. А еще- они нас поддерживают (хотя и не согласны с нашими методами), а беларусы в большинстве своем украинский майдан не поддерживали. Конечно, я увидела вторую часть поста про помощь, доброту и поддержку. Но, к сожалению, первая часть меня лично больше впечатлила.",8.0,0.0
"я против политики была,есть и буду!!!!
 Мы,можем только говорить об этом,но изменить,к сожалению не можем ни чего.
 Каждый видит,то,что ему ближе!
 Хотела донести одно,но получается все равно,все пишут о том,что больше тревожит!
 И так...Читаем- все народности братья, кто-то пострадал больше или меньше...но орешки и тортики ни кто не отменял!))",1.0,0.0
"да, с соседями надо жить дружно. Видела ниже в ленте фото ваших тортиков- выглядят бесподобно. Здорово, что вы хорошо печете, готовы делиться с другими и делать мир лучше)",1.0,1.0
"да пожалуйста,делайте заказы или напишите,кто не может себе позволить купить,сделаю бесплатно!",0.0,1.0
"действительно, в любой нации есть как хорошие , так и не очень , но хочется верить что мы лучшие",1.0,1.0
"Спасибо за ваш комментарий! 🤗
 Есть и хорошие и плохие люди,как кто-то написал,не в зависимости от нации.... Писала на эмоциях и о том,что меня больше задело,что больше увидела! Но,есть человеческий фактор,который ни кто не отменял....и в украинском народе есть хорошие люди,кто помогает безвозмездно и т д......
 Пост был обо всем,и о людях и об отношении и о помощи! Опять же,кто,что увидел,кому,что ближе....",0.0,1.0
",приезжайте в гости,все будет! 🤗
 Про посты,почитайте в других группах и сравните,я писала не из воздуха. И не по наслышке знаю про то,как беларусы помогают друг другу!
 Но,все равно,кто мы не есть,главное оставаться людьми,с чувствами!",1.0,1.0
"да я знаю про помощь, сама такая, до сих пор остаюсь Минске с позицией, если не я, то кто, но это жизненная позиция. (мой сын переехал в Польшу с декабря прошлого года из соображений безопасности, уже студент и там). Буду в Варшаве - обязательно вспомню про ваши орешки - вкус детства. Дома я только хлеб пеку, на орешки формы нет. )))",3.0,1.0
"Санкции нас действительно толкают в лапы России, как это не прискорбно(((",0.0,-1.0
",та при чем тут молодец))) Оксана,просто почитать их почты и наши,это небо и земля! Ну правда.... Просто не смогла удержать эмоции свои и написала. Но,в лишь,все равно каждый человек читает то,что хочет и выбирает для него главное.... Вообщем,как ни крути,мил для всех не будешь 😁😁😁",1.0,0.0
"я так поняла по своим личным наблюдениям это потому что украинцы и белорусы в Польше с разными целями. украинцы в Польше - друг другу конкуренты (они зарабатывать приехали), а белорсы в Польше - друг другу собратья по несчастью (их бы тут скорей всего и не было бы если бы не беда дома...).",1.0,0.0
может быть и так((( Не могу судить и не могу говорить за всех.,0.0,0.0
"да,именно субъективно,спасибо что сделали акцент! Везде можно увидеть плохое или хорошее,если захотеть))",0.0,0.0
"воооооот, наконец-то!!!!!!
 Спасибо вам!!!!
 Я писала несколько раз,что я написала о своем,что для меня важно,что я увидела,что меня встревожило и что я хочу......
 Но правда,мы настолько зашуганные,что видим то,что именно мне ближе,что меня тронуло,что меня зацепило,что меня беспокоит....
 Так всегда и везде,но это психология и не все могут понять и увидеть это! Огромное благодарю,что вы прочитали,увидели и написали 🙏🙏🙏🙏🙏🙏🙏🙏🙏🙏😊💕",3.0,1.0
"и ещё? Вы заметили, как все, защищая другую нацию, начали поливать дерьмом свою? Очень жаль, что мы не ценим то, что имеем, привыкли оправдываться. Не можем похвалить кого-то, не унизив себя. Пока так, Победы не будет. Я тоже собираюсь уезжать из РБ, но у меня нет злости к тем, кто остался. Я просто не хочу иметь с ними дело, даже не обсуждая, просто не мой круг. И не осуждаю тех, кто уехал. Они не трусы, они, наоборот, много сделали, я ими восхищаюсь. И ябатек не осуждаю, они со своим кривым зеркалом. Осуждаю тех, кто сравнивает, кто больше сделал, кто меньше. Кто кому чего должен. Это самые страшные люди.",2.0,-1.0
"я много чего вижу!!!!! Но смысл? Если человек настроен агрессивно,то ни чего ему не поможет,пока он не выльет свою агрессию или не сделает что-то... Многие коменты читаю,делаю вывод и не комментирую,не нужно давать подпитку,что б дальше разжигать. Нет!!! Не об этом пост,ну не об этом ,люди!!!
 Но ""свое"",ближе,поэтому,я буду говорить о ""своем"".
 И я так же не имею права осуждать тех,кто не понимает. Уфффф.... 🙈",1.0,-1.0
"и да, среди тех, кто остался, тоже есть герои, а то как-то несправедливо написала 😉!",2.0,1.0
"а ведь они реально хотели вас поддержать, как наполовину украинку 😉 ! Если будем в Варшаве, придём к вам на тортик и познакомиться 🙂 !",1.0,1.0
"я немного знакома с психологией,немного понимаю кто что пишет и почему) Стараюсь держаться,что б не вестись на политику и все остальное... Сдерживаюсь как могу 😁
 Но...
 Такие посты и комментарии,показывают многое....
 Приезжайте в гости,буду рада! И тортик и все остальное,все будет! 💕💕💕💕💕💕",1.0,1.0
"Не о чём. Мы теперь все психологи и психотерапевты. Знаю одного психотерапевта, не очень в своей профессии, который теперь хайпует на нашем горе-движении. Пользы от него нет и, на первый взгляд беды так же. Но, только на первый взгляд, потому что советчиков у нас теперь много, но ведёт это нас в тупик. А проблема в том, и для этого не нужно быть психотерапевтом, что беларусы ещё не состоялись, как нация. Если бы мы были беларуской нацией, нас бы никто не обманул и не использовал в своих интересах.",1.0,-1.0
"вот этот пессимистичный текст точно не поспособствует образованию нации. Нас обманули...С нами сделали... Мы, вообще, взрослые люди или предмет, с которым можно делать что угодно? Кто вас обманул и использовал? Меня лично никто. Лично за меня тысячи людей вышли на площадь, получили травмы физические и психологические, сидят в тюрьмах, уволены с работы, изгнаны из ВНУ и из страны, многие получили и ещё получат штрафы, обыски. Ради меня сейчас в тюрьме Бабарико и Колесникова, ради меня Тихановская бороздит мировые просторы. Может, я их немного обманула, может, я должна сейчас сидеть рядом?",3.0,-1.0
Скорее меня никто. Розовые очки не ношу с детства и видела всё как есть ещё до выборов. И что жестить будут не по-детски и убивать лучших. А с оставшейся массой розовочковых можно смело вступать в российское пространство - они не преграда.,1.0,-1.0
"ну и что? Все это видели, но всё равно шли. Потому что по-другому нельзя. Кто мог не идти, тот не шёл.",1.0,0.0
"я вам запрос отправила и написала в месенджер,проверьте пожалуйста)",0.0,0.0
"Сплочённые, но доверчивые. Этим пользуются наши враги.",0.0,-1.0
"спасибо вам за написанное! Спасибо что прочитали именно то,что я написала! 🙏",1.0,1.0
"да мне бы знающего человека и разбирающегося в этом... Была бы очень благодарна! Если вы понимаете о чем речь,буду признательна пообщаться в личке!",0.0,1.0
"Ну, так перечитайте внимательно ЧТО ИМЕННО Вы написали и может поймёте что с этим постом не так?",3.0,0.0
"я видела их посты,я читала о чем пишут люди! Вы читали,что б украинец украинцу писал о том,что он готов предоставить кров,дать одежду и обувь бесплатно? Я не читала ни разу,почти за 1,5 года в разных группах!
 Это будет последний комет,я закрываю комментарии. Потому что,все равно,это мешать воду в ступе и каждый останется при своем мнении.
 Всем нам,благ,мира,взаимопонимания и любви! 💞💞💞🙏",9.0,1.0
"не бери близко к сердцу... Люди разные.. Подсолнечник тянется к солнцу, а банный лист сама понимаешь куда",1.0,0.0
